{
  "spec": "soksak-spec-platform-release@0.0.1",
  "kind": "spec",
  "id": "soksak-spec",
  "version": "0.0.1",
  "source": {
    "repository": "https://github.com/soksak-ai/soksak-spec",
    "commit": "aaaaaaaaaaaaaaaaaaaaaaaaaaaaaaaaaaaaaaaa"
  },
  "releaseTag": "soksak-spec-v0.0.1",
  "packages": [
    {
      "ecosystem": "javascript",
      "name": "@soksak-ai/plugin-spec",
      "version": "0.0.1",
      "artifact": {
        "url": "https://github.com/soksak-ai/soksak-spec/releases/download/soksak-spec-v0.0.1/soksak-ai-plugin-spec-0.0.1.tgz",
        "sha256": "1111111111111111111111111111111111111111111111111111111111111111",
        "format": "tgz"
      }
    },
    {
      "ecosystem": "rust",
      "name": "soksak-spec-contract",
      "version": "0.0.1"
    },
    {
      "ecosystem": "rust",
      "name": "soksak-spec-service",
      "version": "0.0.1"
    },
    {
      "ecosystem": "rust",
      "name": "soksak-spec-socket",
      "version": "0.0.1"
    }
  ]
}
